<?xml version="1.0"?>
<!DOCTYPE Report
        [
                <!ELEMENT Report (General ,(Doc|BPT)) >
                <!ATTLIST Report ver CDATA #REQUIRED tmZone CDATA #REQUIRED>

                <!ELEMENT General ( DocLocation ) >
                <!ATTLIST General productName CDATA #REQUIRED productVer CDATA #REQUIRED os CDATA #REQUIRED host CDATA #REQUIRED qcserver CDATA #IMPLIED qcproject CDATA #IMPLIED  >

                <!ELEMENT BPT (DName,Res,DVer?,TSet?,TInst?,NodeArgs,AdditionalInfo*,Doc*) >
                <!ATTLIST BPT rID ID #REQUIRED >

                <!ELEMENT Doc (DName,Res,DVer?,TSet?,TInst?,RunType?,DT?,AdditionalInfo*,Step*,DIter*,Step*,Action*,Summary?,TestMaintenanceSummary*,NodeArgs?) >
                <!ATTLIST Doc rID ID #REQUIRED type (Test|BC) "Test" productName CDATA #REQUIRED BCIter CDATA #IMPLIED >

                <!ELEMENT RunType ( #PCDATA )>
                <!ATTLIST RunType fmStep (False|True) "False" batch (False|True) "False" upDesc (False|True) "False" upChk (False|True) "False" upAS (False|True) "False">

                <!ELEMENT DName ( #PCDATA ) >

                <!ELEMENT Res ( #PCDATA ) >

                <!ELEMENT AdditionalInfo (AdditionalDataName,AdditionalDataValue ) >

                <!ELEMENT AdditionalDataName ( #PCDATA ) >

                <!ELEMENT AdditionalDataValue ( #PCDATA ) >

                <!ELEMENT DVer ( #PCDATA ) >

                <!ELEMENT TSet ( #PCDATA ) >

                <!ELEMENT TInst ( #PCDATA ) >

                <!ELEMENT DIter (Step?,Action+,Summary?,NodeArgs)>
                <!ATTLIST DIter rID ID #REQUIRED iterID CDATA #REQUIRED>

                <!ELEMENT DocLocation ( #PCDATA )>

                <!ELEMENT Action (AName,AIter*,(Step|HtmlStep|Action)*,Summary,ActionMaintenanceSummary*,NodeArgs ) >
                <!ATTLIST Action rID ID #REQUIRED>

                <!ELEMENT AIter ((Step|HtmlStep|Action)*,Summary?,NodeArgs) >
                <!ATTLIST AIter rID ID #REQUIRED iterID CDATA #REQUIRED>

                <!ELEMENT AName ( #PCDATA ) >

                <!ELEMENT TestMaintenanceSummary (ActionMaintenanceSummary*) >
                <!ATTLIST TestMaintenanceSummary ObjectsAdded CDATA #REQUIRED ObjectsUpdated CDATA #REQUIRED StepsUpdated CDATA #REQUIRED StepsComments CDATA #REQUIRED><!ELEMENT ActionMaintenanceSummary (ObjectChange* ) >
                <!ATTLIST ActionMaintenanceSummary Action CDATA #REQUIRED Objects CDATA #REQUIRED Updated CDATA #REQUIRED LinesTotal CDATA #REQUIRED Added CDATA #REQUIRED LinesUpdated CDATA #REQUIRED>

                <!ELEMENT ObjectChange  (Hierarchy, PropertyChangeList* ) >
                <!ATTLIST ObjectChange Operation CDATA #IMPLIED OriginalRepository CDATA #IMPLIED>

                <!ELEMENT PropertyChangeList (PropertyDef*) >

                <!ELEMENT PropertyDef (OriginalValue, NewValue) >
                <!ATTLIST PropertyDef PropName CDATA #REQUIRED OriginRegularExpression (True|False) "False" NewRegularExpression (True|False) "False" AddedProperty (True|False) "False" >

                <!ELEMENT OriginalValue ( #PCDATA )>

                <!ELEMENT NewValue ( #PCDATA )>

                <!ELEMENT Hierarchy  (ObjectName, Hierarchy*) >
                <!ATTLIST Hierarchy MicClass CDATA #REQUIRED>

                <!ELEMENT ObjectName  ( #PCDATA ) >

                <!ELEMENT Step (Obj,Details,Time,TimeTick* ,(Step|HtmlStep|Doc)*,NodeArgs) >
                <!ATTLIST Step rID ID #REQUIRED retval CDATA #IMPLIED>

                <!ELEMENT HtmlStep (HTML,TimeTick*,(Step|HtmlStep|Doc)*,NodeArgs) >
                <!ATTLIST HtmlStep rID ID #REQUIRED >

                <!ELEMENT Obj ( #PCDATA ) >
                <!ATTLIST Obj plainTxt (False|True) "True">

                <!ELEMENT Details ( #PCDATA ) >
                <!ATTLIST Details plainTxt (False|True) "True">

                <!ELEMENT Time ( #PCDATA ) >

                <!ELEMENT HTML ( #PCDATA ) >

                <!ELEMENT Disp ( #PCDATA ) >

                <!ELEMENT TimeTick ( #PCDATA ) >

                <!ELEMENT NodeArgs (Disp,TopPane?,BtmPane?)>
                <!ATTLIST NodeArgs eType CDATA #REQUIRED icon CDATA #REQUIRED nRep CDATA #REQUIRED filter (False|True) "True">
                <!ATTLIST NodeArgs status (Passed|Failed|Done|Warning|Information) "Done">
                <!ATTLIST NodeArgs iconSel CDATA #IMPLIED nType CDATA #IMPLIED MovieMarker CDATA "">
                <!ATTLIST NodeArgs Source CDATA #IMPLIED SourceLine CDATA #IMPLIED >

                <!ELEMENT TopPane (Path)>

                <!ELEMENT BtmPane ( (Path|WR)?,ASHilite?)>
                <!ATTLIST BtmPane vType CDATA "HTML">

                <!ELEMENT Path ( #PCDATA ) >

                <!ELEMENT ASHilite ( #PCDATA ) >

                <!ELEMENT WR ( #PCDATA ) >

                <!ELEMENT DT (NodeArgs) >
                <!ATTLIST DT rID ID #REQUIRED>

                <!ELEMENT Summary (Param*)>
                <!ATTLIST Summary sTime CDATA #IMPLIED eTime CDATA #IMPLIED passed CDATA #IMPLIED failed CDATA #IMPLIED warnings CDATA #IMPLIED retval CDATA #IMPLIED stopped (False|True) "False" >

                <!ELEMENT Param (ParamName,ParamVal)+ >
                <!ATTLIST Param paramInOut (In|Out) "In">

                <!ELEMENT ParamName ( #PCDATA ) >

                <!ELEMENT ParamVal ( #PCDATA ) >

                ]
        >
<Report ver="2.0" tmZone="Romance Standard Time">
    <General productName="QuickTest Professional" productVer="10.00" os="Windows XP" host="ROBOTZMIT-XPD7">
        <DocLocation>
            <![CDATA[Q:/20_Applications\20_Zoomit\20_QTP_Tests\020_Zoomit_Automation\050_Security_Testing\ZMT367_Scenario]]></DocLocation>
    </General>
    <Doc rID="T1" productName="QuickTest Professional">
        <DName><![CDATA[ZMT367_Scenario]]></DName>
        <Res><![CDATA[Results]]></Res>
        <DT rID="T2">
            <NodeArgs eType="Table" icon="2" nRep="4" filter="False">
                <Disp><![CDATA[Run-Time Data Table]]></Disp>
                <BtmPane vType="Table">
                    <Path><![CDATA[Default.xls]]></Path>
                </BtmPane>
            </NodeArgs>
        </DT>
        <DIter rID="T3" iterID="1">
            <Action rID="T4">
                <AName><![CDATA[ZMT367_Scenario]]></AName>
                <Action rID="T5">
                    <AName><![CDATA[CreateGenericUser]]></AName>
                    <Step rID="T6">
                        <Obj><![CDATA[CreateGenericUser]]></Obj>
                        <Details><![CDATA[DataTable Row : 1 -> Action Executed.]]></Details>
                        <Time><![CDATA[26/10/2011 - 10:53:10]]></Time>
                        <TimeTick>1319619190</TimeTick>
                        <NodeArgs eType="User" icon="5" nRep="9" status="Passed">
                            <Disp><![CDATA[CreateGenericUser]]></Disp>
                        </NodeArgs>
                    </Step>
                    <Summary sTime="26/10/2011 - 10:53:10" eTime="26/10/2011 - 10:53:10" passed="1" failed="0"
                             warnings="0"></Summary>
                    <NodeArgs eType="StartAction" icon="4" nRep="8" status="Passed">
                        <Disp><![CDATA[CreateGenericUser Summary]]></Disp>
                    </NodeArgs>
                </Action>
                <Action rID="T7">
                    <AName><![CDATA[DocRefUpload]]></AName>
                    <Step rID="T8">
                        <Obj><![CDATA[DocRefUpload]]></Obj>
                        <Details>
                            <![CDATA[DataTable Row : 1 -> UploadDocRef: GetSenderContracts not executed as requested.]]></Details>
                        <Time><![CDATA[26/10/2011 - 10:53:10]]></Time>
                        <TimeTick>1319619190</TimeTick>
                        <NodeArgs eType="User" icon="5" nRep="12">
                            <Disp><![CDATA[DocRefUpload]]></Disp>
                        </NodeArgs>
                    </Step>
                    <Step rID="T9">
                        <Obj><![CDATA[DocRefUpload]]></Obj>
                        <Details>
                            <![CDATA[DataTable Row : 1 -> File  <C:\ZOOMITSYNC\DATA\ZOOMIT\OUT\P9000001001IN-P9000001001IN\DOCREF\P9000001001IN_201110261053111.dat> does exist .]]></Details>
                        <Time><![CDATA[26/10/2011 - 10:53:11]]></Time>
                        <TimeTick>1319619191</TimeTick>
                        <NodeArgs eType="User" icon="5" nRep="13">
                            <Disp><![CDATA[DocRefUpload]]></Disp>
                        </NodeArgs>
                    </Step>
                    <Step rID="T10">
                        <Obj><![CDATA[DocRefUpload]]></Obj>
                        <Details>
                            <![CDATA[DataTable Row : 1 -> Send command executed for file <C:\ZOOMITSYNC\DATA\ZOOMIT\OUT\P9000001001IN-P9000001001IN\DOCREF\P9000001001IN_201110261053111.dat> .]]></Details>
                        <Time><![CDATA[26/10/2011 - 10:53:33]]></Time>
                        <TimeTick>1319619213</TimeTick>
                        <NodeArgs eType="User" icon="5" nRep="14">
                            <Disp><![CDATA[DocRefUpload]]></Disp>
                        </NodeArgs>
                    </Step>
                    <Step rID="T11">
                        <Obj><![CDATA[DocRefUpload]]></Obj>
                        <Details><![CDATA[DataTable Row : 1 -> Action Executed. Passed]]></Details>
                        <Time><![CDATA[26/10/2011 - 10:53:33]]></Time>
                        <TimeTick>1319619213</TimeTick>
                        <NodeArgs eType="User" icon="5" nRep="15" status="Passed">
                            <Disp><![CDATA[DocRefUpload]]></Disp>
                        </NodeArgs>
                    </Step>
                    <Summary sTime="26/10/2011 - 10:53:10" eTime="26/10/2011 - 10:53:33" passed="1" failed="0"
                             warnings="0"></Summary>
                    <NodeArgs eType="StartAction" icon="4" nRep="11" status="Passed">
                        <Disp><![CDATA[DocRefUpload Summary]]></Disp>
                    </NodeArgs>
                </Action>
                <Action rID="T12">
                    <AName><![CDATA[SSH_Command_Prov]]></AName>
                    <Step rID="T13">
                        <Obj><![CDATA[SSH_Command_Prov]]></Obj>
                        <Details><![CDATA[DataTable Row : 1 -> SQL did not return any recods]]></Details>
                        <Time><![CDATA[26/10/2011 - 10:53:33]]></Time>
                        <TimeTick>1319619213</TimeTick>
                        <NodeArgs eType="User" icon="5" nRep="18">
                            <Disp><![CDATA[SSH_Command_Prov]]></Disp>
                        </NodeArgs>
                    </Step>
                    <Step rID="T14">
                        <Obj><![CDATA[SSH_Command_Prov]]></Obj>
                        <Details><![CDATA[DataTable Row : 1 -> SQL did not return any recods]]></Details>
                        <Time><![CDATA[26/10/2011 - 10:53:33]]></Time>
                        <TimeTick>1319619213</TimeTick>
                        <NodeArgs eType="User" icon="5" nRep="19">
                            <Disp><![CDATA[SSH_Command_Prov]]></Disp>
                        </NodeArgs>
                    </Step>
                    <Step rID="T15">
                        <Obj><![CDATA[SSH_Command_Prov]]></Obj>
                        <Details><![CDATA[DataTable Row : 1 -> SQL did not return any recods]]></Details>
                        <Time><![CDATA[26/10/2011 - 10:53:33]]></Time>
                        <TimeTick>1319619213</TimeTick>
                        <NodeArgs eType="User" icon="5" nRep="20">
                            <Disp><![CDATA[SSH_Command_Prov]]></Disp>
                        </NodeArgs>
                    </Step>
                    <Step rID="T16">
                        <Obj><![CDATA[SSH_Command_Prov]]></Obj>
                        <Details><![CDATA[DataTable Row : 1 -> SQL did not return any recods]]></Details>
                        <Time><![CDATA[26/10/2011 - 10:53:33]]></Time>
                        <TimeTick>1319619213</TimeTick>
                        <NodeArgs eType="User" icon="5" nRep="21">
                            <Disp><![CDATA[SSH_Command_Prov]]></Disp>
                        </NodeArgs>
                    </Step>
                    <Step rID="T17">
                        <Obj><![CDATA[SSH_Command_Prov]]></Obj>
                        <Details><![CDATA[DataTable Row : 1 -> SQL did not return any recods]]></Details>
                        <Time><![CDATA[26/10/2011 - 10:53:33]]></Time>
                        <TimeTick>1319619213</TimeTick>
                        <NodeArgs eType="User" icon="5" nRep="22">
                            <Disp><![CDATA[SSH_Command_Prov]]></Disp>
                        </NodeArgs>
                    </Step>
                    <Step rID="T18">
                        <Obj><![CDATA[SSH_Command_Prov]]></Obj>
                        <Details><![CDATA[DataTable Row : 1 -> SQL did not return any recods]]></Details>
                        <Time><![CDATA[26/10/2011 - 10:53:33]]></Time>
                        <TimeTick>1319619213</TimeTick>
                        <NodeArgs eType="User" icon="5" nRep="23">
                            <Disp><![CDATA[SSH_Command_Prov]]></Disp>
                        </NodeArgs>
                    </Step>
                    <Step rID="T19">
                        <Obj><![CDATA[SSH_Command_Prov]]></Obj>
                        <Details><![CDATA[DataTable Row : 1 -> SQL did not return any recods]]></Details>
                        <Time><![CDATA[26/10/2011 - 10:53:34]]></Time>
                        <TimeTick>1319619214</TimeTick>
                        <NodeArgs eType="User" icon="5" nRep="24">
                            <Disp><![CDATA[SSH_Command_Prov]]></Disp>
                        </NodeArgs>
                    </Step>
                    <Step rID="T20">
                        <Obj><![CDATA[SSH_Command_Prov]]></Obj>
                        <Details><![CDATA[DataTable Row : 1 -> SQL did not return any recods]]></Details>
                        <Time><![CDATA[26/10/2011 - 10:53:34]]></Time>
                        <TimeTick>1319619214</TimeTick>
                        <NodeArgs eType="User" icon="5" nRep="25">
                            <Disp><![CDATA[SSH_Command_Prov]]></Disp>
                        </NodeArgs>
                    </Step>
                    <Step rID="T21">
                        <Obj><![CDATA[SSH_Command_Prov]]></Obj>
                        <Details><![CDATA[DataTable Row : 1 -> SQL did not return any recods]]></Details>
                        <Time><![CDATA[26/10/2011 - 10:53:34]]></Time>
                        <TimeTick>1319619214</TimeTick>
                        <NodeArgs eType="User" icon="5" nRep="26">
                            <Disp><![CDATA[SSH_Command_Prov]]></Disp>
                        </NodeArgs>
                    </Step>
                    <Step rID="T22">
                        <Obj><![CDATA[SSH_Command_Prov]]></Obj>
                        <Details><![CDATA[DataTable Row : 1 -> SQL did not return any recods]]></Details>
                        <Time><![CDATA[26/10/2011 - 10:53:34]]></Time>
                        <TimeTick>1319619214</TimeTick>
                        <NodeArgs eType="User" icon="5" nRep="27">
                            <Disp><![CDATA[SSH_Command_Prov]]></Disp>
                        </NodeArgs>
                    </Step>
                    <Step rID="T23">
                        <Obj><![CDATA[SSH_Command_Prov]]></Obj>
                        <Details><![CDATA[DataTable Row : 1 -> SQL did not return any recods]]></Details>
                        <Time><![CDATA[26/10/2011 - 10:53:34]]></Time>
                        <TimeTick>1319619214</TimeTick>
                        <NodeArgs eType="User" icon="5" nRep="28">
                            <Disp><![CDATA[SSH_Command_Prov]]></Disp>
                        </NodeArgs>
                    </Step>
                    <Step rID="T24">
                        <Obj><![CDATA[SSH_Command_Prov]]></Obj>
                        <Details><![CDATA[DataTable Row : 1 -> SQL did not return any recods]]></Details>
                        <Time><![CDATA[26/10/2011 - 10:53:34]]></Time>
                        <TimeTick>1319619214</TimeTick>
                        <NodeArgs eType="User" icon="5" nRep="29">
                            <Disp><![CDATA[SSH_Command_Prov]]></Disp>
                        </NodeArgs>
                    </Step>
                    <Step rID="T25">
                        <Obj><![CDATA[SSH_Command_Prov]]></Obj>
                        <Details><![CDATA[DataTable Row : 1 -> SQL did not return any recods]]></Details>
                        <Time><![CDATA[26/10/2011 - 10:53:34]]></Time>
                        <TimeTick>1319619214</TimeTick>
                        <NodeArgs eType="User" icon="5" nRep="30">
                            <Disp><![CDATA[SSH_Command_Prov]]></Disp>
                        </NodeArgs>
                    </Step>
                    <Step rID="T26">
                        <Obj><![CDATA[SSH_Command_Prov]]></Obj>
                        <Details><![CDATA[DataTable Row : 1 -> SQL did not return any recods]]></Details>
                        <Time><![CDATA[26/10/2011 - 10:53:34]]></Time>
                        <TimeTick>1319619214</TimeTick>
                        <NodeArgs eType="User" icon="5" nRep="31">
                            <Disp><![CDATA[SSH_Command_Prov]]></Disp>
                        </NodeArgs>
                    </Step>
                    <Step rID="T27">
                        <Obj><![CDATA[SSH_Command_Prov]]></Obj>
                        <Details><![CDATA[DataTable Row : 1 -> SQL did not return any recods]]></Details>
                        <Time><![CDATA[26/10/2011 - 10:53:34]]></Time>
                        <TimeTick>1319619214</TimeTick>
                        <NodeArgs eType="User" icon="5" nRep="32">
                            <Disp><![CDATA[SSH_Command_Prov]]></Disp>
                        </NodeArgs>
                    </Step>
                    <Step rID="T28">
                        <Obj><![CDATA[SSH_Command_Prov]]></Obj>
                        <Details><![CDATA[DataTable Row : 1 -> SQL did not return any recods]]></Details>
                        <Time><![CDATA[26/10/2011 - 10:53:34]]></Time>
                        <TimeTick>1319619214</TimeTick>
                        <NodeArgs eType="User" icon="5" nRep="33">
                            <Disp><![CDATA[SSH_Command_Prov]]></Disp>
                        </NodeArgs>
                    </Step>
                    <Step rID="T29">
                        <Obj><![CDATA[SSH_Command_Prov]]></Obj>
                        <Details><![CDATA[DataTable Row : 1 -> SQL did not return any recods]]></Details>
                        <Time><![CDATA[26/10/2011 - 10:53:34]]></Time>
                        <TimeTick>1319619214</TimeTick>
                        <NodeArgs eType="User" icon="5" nRep="34">
                            <Disp><![CDATA[SSH_Command_Prov]]></Disp>
                        </NodeArgs>
                    </Step>
                    <Step rID="T30">
                        <Obj><![CDATA[SSH_Command_Prov]]></Obj>
                        <Details><![CDATA[DataTable Row : 1 -> SQL did not return any recods]]></Details>
                        <Time><![CDATA[26/10/2011 - 10:53:34]]></Time>
                        <TimeTick>1319619214</TimeTick>
                        <NodeArgs eType="User" icon="5" nRep="35">
                            <Disp><![CDATA[SSH_Command_Prov]]></Disp>
                        </NodeArgs>
                    </Step>
                    <Step rID="T31">
                        <Obj><![CDATA[SSH_Command_Prov]]></Obj>
                        <Details><![CDATA[DataTable Row : 1 -> SQL did not return any recods]]></Details>
                        <Time><![CDATA[26/10/2011 - 10:53:35]]></Time>
                        <TimeTick>1319619215</TimeTick>
                        <NodeArgs eType="User" icon="5" nRep="36">
                            <Disp><![CDATA[SSH_Command_Prov]]></Disp>
                        </NodeArgs>
                    </Step>
                    <Step rID="T32">
                        <Obj><![CDATA[SSH_Command_Prov]]></Obj>
                        <Details><![CDATA[DataTable Row : 1 -> SQL did not return any recods]]></Details>
                        <Time><![CDATA[26/10/2011 - 10:53:35]]></Time>
                        <TimeTick>1319619215</TimeTick>
                        <NodeArgs eType="User" icon="5" nRep="37">
                            <Disp><![CDATA[SSH_Command_Prov]]></Disp>
                        </NodeArgs>
                    </Step>
                    <Step rID="T33">
                        <Obj><![CDATA[SSH_Command_Prov]]></Obj>
                        <Details><![CDATA[DataTable Row : 1 -> SQL did not return any recods]]></Details>
                        <Time><![CDATA[26/10/2011 - 10:53:35]]></Time>
                        <TimeTick>1319619215</TimeTick>
                        <NodeArgs eType="User" icon="5" nRep="38">
                            <Disp><![CDATA[SSH_Command_Prov]]></Disp>
                        </NodeArgs>
                    </Step>
                    <Step rID="T34">
                        <Obj><![CDATA[SSH_Command_Prov]]></Obj>
                        <Details><![CDATA[DataTable Row : 1 -> SQL did not return any recods]]></Details>
                        <Time><![CDATA[26/10/2011 - 10:53:35]]></Time>
                        <TimeTick>1319619215</TimeTick>
                        <NodeArgs eType="User" icon="5" nRep="39">
                            <Disp><![CDATA[SSH_Command_Prov]]></Disp>
                        </NodeArgs>
                    </Step>
                    <Step rID="T35">
                        <Obj><![CDATA[SSH_Command_Prov]]></Obj>
                        <Details><![CDATA[DataTable Row : 1 -> SQL did not return any recods]]></Details>
                        <Time><![CDATA[26/10/2011 - 10:53:35]]></Time>
                        <TimeTick>1319619215</TimeTick>
                        <NodeArgs eType="User" icon="5" nRep="40">
                            <Disp><![CDATA[SSH_Command_Prov]]></Disp>
                        </NodeArgs>
                    </Step>
                    <Step rID="T36">
                        <Obj><![CDATA[SSH_Command_Prov]]></Obj>
                        <Details><![CDATA[DataTable Row : 1 -> SQL did not return any recods]]></Details>
                        <Time><![CDATA[26/10/2011 - 10:53:35]]></Time>
                        <TimeTick>1319619215</TimeTick>
                        <NodeArgs eType="User" icon="5" nRep="41">
                            <Disp><![CDATA[SSH_Command_Prov]]></Disp>
                        </NodeArgs>
                    </Step>
                    <Step rID="T37">
                        <Obj><![CDATA[SSH_Command_Prov]]></Obj>
                        <Details><![CDATA[DataTable Row : 1 -> SQL did not return any recods]]></Details>
                        <Time><![CDATA[26/10/2011 - 10:53:35]]></Time>
                        <TimeTick>1319619215</TimeTick>
                        <NodeArgs eType="User" icon="5" nRep="42">
                            <Disp><![CDATA[SSH_Command_Prov]]></Disp>
                        </NodeArgs>
                    </Step>
                    <Step rID="T38">
                        <Obj><![CDATA[SSH_Command_Prov]]></Obj>
                        <Details><![CDATA[DataTable Row : 1 -> SQL did not return any recods]]></Details>
                        <Time><![CDATA[26/10/2011 - 10:53:35]]></Time>
                        <TimeTick>1319619215</TimeTick>
                        <NodeArgs eType="User" icon="5" nRep="43">
                            <Disp><![CDATA[SSH_Command_Prov]]></Disp>
                        </NodeArgs>
                    </Step>
                    <Step rID="T39">
                        <Obj><![CDATA[SSH_Command_Prov]]></Obj>
                        <Details><![CDATA[DataTable Row : 1 -> SQL did not return any recods]]></Details>
                        <Time><![CDATA[26/10/2011 - 10:53:35]]></Time>
                        <TimeTick>1319619215</TimeTick>
                        <NodeArgs eType="User" icon="5" nRep="44">
                            <Disp><![CDATA[SSH_Command_Prov]]></Disp>
                        </NodeArgs>
                    </Step>
                    <Step rID="T40">
                        <Obj><![CDATA[SSH_Command_Prov]]></Obj>
                        <Details><![CDATA[DataTable Row : 1 -> SQL did not return any recods]]></Details>
                        <Time><![CDATA[26/10/2011 - 10:53:35]]></Time>
                        <TimeTick>1319619215</TimeTick>
                        <NodeArgs eType="User" icon="5" nRep="45">
                            <Disp><![CDATA[SSH_Command_Prov]]></Disp>
                        </NodeArgs>
                    </Step>
                    <Step rID="T41">
                        <Obj><![CDATA[SSH_Command_Prov]]></Obj>
                        <Details><![CDATA[DataTable Row : 1 -> SQL did not return any recods]]></Details>
                        <Time><![CDATA[26/10/2011 - 10:53:35]]></Time>
                        <TimeTick>1319619215</TimeTick>
                        <NodeArgs eType="User" icon="5" nRep="46">
                            <Disp><![CDATA[SSH_Command_Prov]]></Disp>
                        </NodeArgs>
                    </Step>
                    <Step rID="T42">
                        <Obj><![CDATA[SSH_Command_Prov]]></Obj>
                        <Details><![CDATA[DataTable Row : 1 -> SQL did not return any recods]]></Details>
                        <Time><![CDATA[26/10/2011 - 10:53:36]]></Time>
                        <TimeTick>1319619216</TimeTick>
                        <NodeArgs eType="User" icon="5" nRep="47">
                            <Disp><![CDATA[SSH_Command_Prov]]></Disp>
                        </NodeArgs>
                    </Step>
                    <Step rID="T43">
                        <Obj><![CDATA[SSH_Command_Prov]]></Obj>
                        <Details><![CDATA[DataTable Row : 1 -> SQL did not return any recods]]></Details>
                        <Time><![CDATA[26/10/2011 - 10:53:36]]></Time>
                        <TimeTick>1319619216</TimeTick>
                        <NodeArgs eType="User" icon="5" nRep="48">
                            <Disp><![CDATA[SSH_Command_Prov]]></Disp>
                        </NodeArgs>
                    </Step>
                    <Step rID="T44">
                        <Obj><![CDATA[SSH_Command_Prov]]></Obj>
                        <Details><![CDATA[DataTable Row : 1 -> SQL did not return any recods]]></Details>
                        <Time><![CDATA[26/10/2011 - 10:53:36]]></Time>
                        <TimeTick>1319619216</TimeTick>
                        <NodeArgs eType="User" icon="5" nRep="49">
                            <Disp><![CDATA[SSH_Command_Prov]]></Disp>
                        </NodeArgs>
                    </Step>
                    <Step rID="T45">
                        <Obj><![CDATA[SSH_Command_Prov]]></Obj>
                        <Details><![CDATA[DataTable Row : 1 -> SQL did not return any recods]]></Details>
                        <Time><![CDATA[26/10/2011 - 10:53:36]]></Time>
                        <TimeTick>1319619216</TimeTick>
                        <NodeArgs eType="User" icon="5" nRep="50">
                            <Disp><![CDATA[SSH_Command_Prov]]></Disp>
                        </NodeArgs>
                    </Step>
                    <Step rID="T46">
                        <Obj><![CDATA[SSH_Command_Prov]]></Obj>
                        <Details><![CDATA[DataTable Row : 1 -> SQL did not return any recods]]></Details>
                        <Time><![CDATA[26/10/2011 - 10:53:36]]></Time>
                        <TimeTick>1319619216</TimeTick>
                        <NodeArgs eType="User" icon="5" nRep="51">
                            <Disp><![CDATA[SSH_Command_Prov]]></Disp>
                        </NodeArgs>
                    </Step>
                    <Step rID="T47">
                        <Obj><![CDATA[SSH_Command_Prov]]></Obj>
                        <Details><![CDATA[DataTable Row : 1 -> SQL did not return any recods]]></Details>
                        <Time><![CDATA[26/10/2011 - 10:53:36]]></Time>
                        <TimeTick>1319619216</TimeTick>
                        <NodeArgs eType="User" icon="5" nRep="52">
                            <Disp><![CDATA[SSH_Command_Prov]]></Disp>
                        </NodeArgs>
                    </Step>
                    <Step rID="T48">
                        <Obj><![CDATA[SSH_Command_Prov]]></Obj>
                        <Details><![CDATA[DataTable Row : 1 -> SQL did not return any recods]]></Details>
                        <Time><![CDATA[26/10/2011 - 10:53:36]]></Time>
                        <TimeTick>1319619216</TimeTick>
                        <NodeArgs eType="User" icon="5" nRep="53">
                            <Disp><![CDATA[SSH_Command_Prov]]></Disp>
                        </NodeArgs>
                    </Step>
                    <Step rID="T49">
                        <Obj><![CDATA[SSH_Command_Prov]]></Obj>
                        <Details><![CDATA[DataTable Row : 1 -> SQL did not return any recods]]></Details>
                        <Time><![CDATA[26/10/2011 - 10:53:36]]></Time>
                        <TimeTick>1319619216</TimeTick>
                        <NodeArgs eType="User" icon="5" nRep="54">